<?xml version="1.0"?>
<xs:schema
    xmlns:xs="http://www.w3.org/2001/XMLSchema"
    xmlns:zoo="http://www.zoo.com"
    targetNamespace="http://www.zoo.com"
    elementFormDefault="qualified">

<xs:element name="workers" type="zoo:Tworkers"/>

<xs:complexType name="Tworkers">
    <xs:sequence  maxOccurs="unbounded">
        <xs:element name="impiegato" type ="zoo:Timpiegato" minOccurs="0" />
        <xs:element name="manager" type ="zoo:Tmanager" minOccurs="0"/>
    </xs:sequence>
</xs:complexType>

<xs:complexType name="Timpiegato">
    <xs:sequence>
        <xs:element name="username" type ="xs:string"/>
        <xs:element name="password" type ="xs:string"/>
        <xs:element name="nome" type ="xs:string"/>
        <xs:element name="sesso" type ="zoo:Tsesso"/>
        <xs:element name="eta" type="zoo:Teta"/>
    </xs:sequence>
</xs:complexType>

<xs:complexType name="Tmanager">
    <xs:sequence>
        <xs:element name="username" type ="xs:string"/>
        <xs:element name="password" type ="xs:string"/>
        <xs:element name="nome" type ="xs:string"/>
        <xs:element name="sesso" type ="zoo:Tsesso"/>
        <xs:element name="eta" type="zoo:Teta"/>
    </xs:sequence>
</xs:complexType>

<xs:simpleType name="Tsesso">
    <xs:restriction base="xs:string">
        <xs:enumeration value="F"/>
        <xs:enumeration value="M"/>
    </xs:restriction>
</xs:simpleType>

<xs:simpleType name="Teta">
    <xs:restriction base="xs:integer">
        <xs:minInclusive value="0"/>
    </xs:restriction>
</xs:simpleType>

</xs:schema>

