<workers xmlns="http://www.zoo.com" xmlns:xs="http://www.w3.org/2001/XMLSchema-instance" xs:schemaLocation="http://www.zoo.com worker.xsd">
    <impiegato>
        <username>mario</username>
        <password>k8n3IKklUMu2fg</password>
        <nome>Mario</nome>
        <sesso>F</sesso>
        <eta>23</eta>
    </impiegato>

    <impiegato>
        <username>maria</username>
        <password>M8x2IK5lJMu9k1</password>
        <nome>Maria</nome>
        <sesso>F</sesso>
        <eta>51</eta>
    </impiegato>

    <impiegato>
        <username>mirco</username>
        <password>b8x2kI6lJMg3kh</password>
        <nome>Mirco</nome>
        <sesso>F</sesso>
        <eta>27</eta>
    </impiegato>

    <impiegato>
        <username>martina</username>
        <password>bzx2kP3lJIg3nh</password>
        <nome>Martina</nome>
        <sesso>M</sesso>
        <eta>26</eta>
    </impiegato>

    <manager>
        <username>marco</username>
        <password>mzx2kP3qJDg3kg</password>
        <nome>Marco</nome>
        <sesso>M</sesso>
        <eta>25</eta>
    </manager>

    <manager>
        <username>giovanna</username>
        <password>zxVcGz0BPdHkY</password>
        <nome>Giovanna</nome>
        <sesso>F</sesso>
        <eta>24</eta>
    </manager>

		<manager>
			<username>lucanervi</username>
			<password>zxePlNSDQjsxg</password>
			<nome>Luca Nervi</nome>
			<sesso>M</sesso>
			<eta>23</eta>
		</manager>


		<impiegato>
			<username>paolobitta</username>
			<password>zx2kL4qmDw3kg</password>
			<nome>Paolo Bitta</nome>
			<sesso>M</sesso>
			<eta>35</eta>
		</impiegato>
		
	<manager>
		<username>ombretta</username>
		<password>zxFSwnannEpRc</password>
		<nome>Ombretta</nome>
		<sesso>F</sesso>
		<eta>35</eta>
	</manager>
<impiegato><username>ogaggi</username><password>zxPmex6//Xpx6</password><nome>Gaggi</nome><sesso>F</sesso><eta>35</eta></impiegato></workers>